{
  "$schema": "https://json-schema.org/draft/2020-12/schema",
  "$id": "https://prm.dev/schemas/prm-key-event-v1.schema.json",
  "title": "PRM Key Event v1",
  "description": "One entry in a self-certifying, hash-chained Key Event Log. accountId = 'prm:' + base32-nopad-lower(SHA-256(JCS(genesis event minus proof)))[0..25]. Signature domain prefix 'PRM-KEYEVENT-v1\\x00'.",
  "type": "object",
  "required": ["type", "eventType", "sequence", "previousEventHash", "created", "keys", "nextKeyDigests", "threshold", "proof"],
  "additionalProperties": false,
  "properties": {
    "type": { "const": "prm/KeyEvent/v1" },
    "eventType": {
      "enum": ["genesis", "rotation", "recovery", "revocation", "delegation"],
      "description": "genesis: sequence 0. rotation: signed by current AND pre-committed next key. recovery: signed by a pre-committed recovery key. revocation: marks a key compromised from an instant. delegation: registers an additional authorized signer (including any opt-in custodial arrangement, which is therefore publicly visible)."
    },
    "sequence": { "type": "integer", "minimum": 0 },
    "previousEventHash": { "oneOf": [{ "$ref": "#/$defs/multihash" }, { "type": "null" }] },
    "created": { "$ref": "#/$defs/utcInstant" },

    "keys": {
      "type": "array",
      "minItems": 1,
      "items": {
        "type": "object",
        "required": ["id", "alg", "publicKeyMultibase"],
        "additionalProperties": false,
        "properties": {
          "id": { "type": "string", "pattern": "^#[A-Za-z0-9_-]{1,32}$" },
          "alg": { "enum": ["Ed25519", "ES256"], "$comment": "ES256 permitted so a Secure Enclave / StrongBox device key can be an authorized signer without ever reconstructing the seed. Algorithm-tagged so ML-DSA can be added later by rotation, not redesign." },
          "publicKeyMultibase": { "type": "string", "pattern": "^z[1-9A-HJ-NP-Za-km-z]{40,}$" },
          "use": { "type": "array", "items": { "enum": ["assertion", "authentication", "capability"] } },
          "device": { "type": "string", "maxLength": 64, "description": "User-facing label only. No device fingerprinting." }
        }
      }
    },

    "nextKeyDigests": {
      "type": "array",
      "minItems": 1,
      "items": { "$ref": "#/$defs/multihash" },
      "description": "PRE-ROTATION COMMITMENT. A rotation is valid only if it reveals a public key whose digest appears here. This is what prevents an attacker holding the current signing key from taking over the account."
    },
    "recoveryKeyDigests": { "type": "array", "items": { "$ref": "#/$defs/multihash" } },
    "threshold": { "type": "integer", "minimum": 1 },

    "revokedKeys": {
      "type": "array",
      "items": {
        "type": "object",
        "required": ["publicKeyMultibase", "effectiveFrom"],
        "additionalProperties": false,
        "properties": {
          "publicKeyMultibase": { "type": "string" },
          "effectiveFrom": { "$ref": "#/$defs/utcInstant" },
          "reason": { "enum": ["compromise", "superseded", "device-loss", "unspecified"] }
        }
      },
      "$comment": "CRL semantics: signatures whose log inclusion time precedes effectiveFrom REMAIN valid. Revoking must not destroy the evidentiary value of past signatures."
    },

    "services": {
      "type": "array",
      "items": {
        "type": "object",
        "required": ["type", "endpoint"],
        "additionalProperties": false,
        "properties": {
          "type": { "type": "string", "examples": ["PRMPublisher", "PRMLedger", "PRMContact"] },
          "endpoint": { "type": "string", "format": "uri" }
        }
      }
    },

    "proof": {
      "type": "array",
      "minItems": 1,
      "items": { "$ref": "https://prm.dev/schemas/prm-policy-v1.schema.json#/$defs/dataIntegrityProof" },
      "description": "Array because a rotation carries TWO signatures: one by the outgoing key, one by the newly revealed pre-committed key."
    }
  },
  "allOf": [
    {
      "if": { "properties": { "eventType": { "const": "genesis" } }, "required": ["eventType"] },
      "then": {
        "properties": { "sequence": { "const": 0 }, "previousEventHash": { "type": "null" } },
        "required": ["recoveryKeyDigests"]
      },
      "else": {
        "properties": { "sequence": { "minimum": 1 }, "previousEventHash": { "$ref": "#/$defs/multihash" } }
      }
    },
    {
      "if": { "properties": { "eventType": { "const": "rotation" } }, "required": ["eventType"] },
      "then": { "properties": { "proof": { "minItems": 2 } } }
    }
  ],
  "$defs": {
    "multihash": { "type": "string", "pattern": "^u[A-Za-z0-9_-]{40,}$" },
    "utcInstant": { "type": "string", "pattern": "^\\d{4}-\\d{2}-\\d{2}T\\d{2}:\\d{2}:\\d{2}Z$" }
  }
}
