{
  "type": "prm/KeyEvent/v1",
  "eventType": "rotation",
  "sequence": 1,
  "previousEventHash": "uEiBiEkqvg-0kUuagfgLtlsBINn4IOVDRsI7YQY2tj3VylQ",
  "created": "2027-09-06T09:00:00Z",
  "keys": [
    {
      "id": "#k1",
      "alg": "Ed25519",
      "publicKeyMultibase": "z6Mkm1UPdBHW6PjW7uD6FzPh8Goa2LHtHG3Auztep7gh6aEY",
      "use": [
        "assertion",
        "authentication"
      ],
      "device": "laptop"
    }
  ],
  "nextKeyDigests": [
    "uEiBwYCdb6dWDK1g62aDXJDIldk1cE6qMWj86nsvSCR74uw"
  ],
  "recoveryKeyDigests": [
    "uEiAPoEpq_H2t76OX_fxALg_ORF1jMHxANV_qGi30FacsAg"
  ],
  "threshold": 1,
  "services": [
    {
      "type": "PRMPublisher",
      "endpoint": "https://rightsroot.com/u/ab12cd"
    }
  ],
  "proof": [
    {
      "type": "DataIntegrityProof",
      "cryptosuite": "eddsa-jcs-2022",
      "created": "2027-09-06T09:00:00Z",
      "verificationMethod": "did:key:z6MkrXkKJa4ytWRY9ZtJXK3k3o9dsrLdKYC5vhRbZjZfu4Zo#z6MkrXkKJa4ytWRY9ZtJXK3k3o9dsrLdKYC5vhRbZjZfu4Zo",
      "proofPurpose": "assertionMethod",
      "proofValue": "z4Pyr5RLWQhaSvS7K2t2bsm4YmwJnoMSsN4JrE8rmNm8ycT9JRcmMBGZHMnNidEPzdFtN7qvcZN1AYWFPAGfqL9z5"
    },
    {
      "type": "DataIntegrityProof",
      "cryptosuite": "eddsa-jcs-2022",
      "created": "2027-09-06T09:00:00Z",
      "verificationMethod": "did:key:z6Mkm1UPdBHW6PjW7uD6FzPh8Goa2LHtHG3Auztep7gh6aEY#z6Mkm1UPdBHW6PjW7uD6FzPh8Goa2LHtHG3Auztep7gh6aEY",
      "proofPurpose": "assertionMethod",
      "proofValue": "z3FD4vh8VfrVF9JYcD8SHyz6nLmvKMLoEszhC5s9CvDDL9nMS96CQtcoDbeg7T3BSUVXJv3968enhtUNoAtKfsF7A"
    }
  ]
}
