{
  "type": "prm/KeyEvent/v1",
  "eventType": "genesis",
  "sequence": 0,
  "previousEventHash": null,
  "created": "2026-09-06T14:02:11Z",
  "keys": [
    {
      "id": "#k0",
      "alg": "Ed25519",
      "publicKeyMultibase": "z6MkrXkKJa4ytWRY9ZtJXK3k3o9dsrLdKYC5vhRbZjZfu4Zo",
      "use": [
        "assertion",
        "authentication"
      ],
      "device": "laptop"
    }
  ],
  "nextKeyDigests": [
    "uEiDsdox-1fldhS7P-FTmnFQm79qpkYb-HmUzq_clkydkMg"
  ],
  "recoveryKeyDigests": [
    "uEiAPoEpq_H2t76OX_fxALg_ORF1jMHxANV_qGi30FacsAg"
  ],
  "threshold": 1,
  "services": [
    {
      "type": "PRMPublisher",
      "endpoint": "https://rightsroot.com/u/ab12cd"
    }
  ],
  "proof": [
    {
      "type": "DataIntegrityProof",
      "cryptosuite": "eddsa-jcs-2022",
      "created": "2026-09-06T14:02:11Z",
      "verificationMethod": "did:key:z6MkrXkKJa4ytWRY9ZtJXK3k3o9dsrLdKYC5vhRbZjZfu4Zo#z6MkrXkKJa4ytWRY9ZtJXK3k3o9dsrLdKYC5vhRbZjZfu4Zo",
      "proofPurpose": "assertionMethod",
      "proofValue": "z2ifQQS14j7yDNFBxSZpy1U6WUjxEBiJJe8S8JWQiyS66wrUpntpp9BfGvYzpPxM3489LtiXKwAyjq2R7Pe3qEQwB"
    }
  ]
}
